{
  "version": "developer-analysis-input-v1",
  "run_id": "11111111-1111-1111-1111-111111111111",
  "request_id": "22222222-2222-2222-2222-222222222222",
  "pins": {
    "criterion_version_ids": [],
    "task_version_ids": []
  },
  "analyzer_version": "unified-diff-v1",
  "rule_version": "developer-taxonomy-v1",
  "snapshot": {
    "id": "33333333-3333-3333-3333-333333333333",
    "hash": "35e16f7004e359b9120dddadd03ea0aac5a2c1ebab27f5ed598328462536402d",
    "base_sha": "aaaaaaaaaaaaaaaaaaaaaaaaaaaaaaaaaaaaaaaa",
    "head_sha": "bbbbbbbbbbbbbbbbbbbbbbbbbbbbbbbbbbbbbbbb",
    "source_instance_id": "synthetic",
    "repository_id": "repo",
    "mr_id": "42",
    "revision_ordinal": 1,
    "paths": [
      {
        "old_path": "app/a.py",
        "new_path": "app/a.py"
      }
    ],
    "redacted_diff": "diff --git a/app/a.py b/app/a.py\n--- a/app/a.py\n+++ b/app/a.py\n@@ -1,1 +1,1 @@\n-old\n+Ω  \n",
    "redaction": {
      "version": "secret-gate-v1",
      "policy": "block-v1",
      "hash": "35e16f7004e359b9120dddadd03ea0aac5a2c1ebab27f5ed598328462536402d",
      "mapping": []
    }
  },
  "input_hash": "68c49a42c2e9767085b17b41830073ac02e6b1a6af05feac46f1bbe2bb06fb91"
}
